headline,contents,url,category,name
 ‘대소변 먹이며 가혹행위’…8살 딸 학대·살해 부부 항소,"초등학생인 8살 딸에게 식사를 제대로 주지 않고 대소변을 먹이는 등 가혹행위 수준의 학대를 한 끝에 살해한 20대 부부가 1심 판결에 불복해 항소했다. 28일 인천지법에 따르면 살인 및 아동복지법상 상습아동학대 등 혐의로 구속 기소돼 최근 1심에서 징역 30년을 선고받은 A씨(28·여)는 지난 26일 법원에 항소했다. A씨와 함께 기소돼 같은 형을 선고받은 그의 남편 B씨(27)도 이날 뒤늦게 변호인을 통해 항소장을 제출했다. 검찰은 구형과 같은 형이 1심에서 선고됐지만 이례적으로 항소장을 법원에 냈다. 검찰은 ‘불이익 변경금지’ 원칙에 따라 항소심에서 A씨 부부의 형량이 줄어드는 것을 막기 위해 맞항소를 한 것으로 알려졌다. 불이익 변경금지는 피고인만 1심 판결에 불복해 항소한 경우 1심보다 무거운 형을 선고할 수 없는 원칙이다. 그러나 검찰 관계자는 “구체적인 항소 이유는 아직 밝힐 수 없다”며 “구형과 같은 형이 1심에서 선고됐지만 법과 원칙에 따라 항소했다”고 말했다. A씨 부부의 항소심은 서울고법에서 열릴 전망이다. 1심 법원이 소송기록을 정리해 서울고법으로 넘기면 항소심을 담당할 재판부가 결정된다. A씨 부부는 올해 3월 2일 인천시 중구 한 빌라에서 초등학교 3학년생인 딸 C양(8)을 학대해 숨지게 한 혐의로 구속 기소됐다. C양은 사망 당시 얼굴·팔·다리 등 몸 곳곳에 멍 자국이 있었고, 110㎝의 키에 몸무게는 또래 평균(26㎏)의 절반인 13㎏으로 심한 저체중 상태였다. 부검 감정서에는 ‘온몸에 살이 없어 뼈대만 드러났고 지방층도 손실돼 없으며 위와 창자에 내용물도 없다’는 내용이 담겼다. A씨 부부는 거짓말을 한다거나 대소변 실수를 했다며 C양의 온몸을 때렸고, 6시간 동안 ‘엎드려뻗쳐’를 시키는 등 올해 3월 초까지 35차례나 학대한 것으로 조사됐다. 지난해 8월부터는 딸에게 반찬없이 맨밥만 주거나 하루나 이틀 동안 식사나 물을 전혀 주지 않고 굶기기도 했다. 이 때문에 C양은 지난해 12월부터 밥을 스스로 먹지 못하고 얼굴색도 변할 정도로 건강이 나빠졌다. A씨는 지난해 10월 또 대소변 실수를 했다며 C양을 화장실로 데리고 간 뒤 변기에 있는 대변을 먹게 했다. A씨 부부는 1심 재판에서 딸을 학대한 사실은 인정하면서도 살인의 고의성은 전면 부인했다.",https://www.khan.co.kr/national/court-law/article/202107281523001,사회,경향
 금석배 축구대회 관계자 8명 확진…대회 전격 중단,"지난 24일부터 전북 군산시에서 열리고 있는 ‘금석배 전국 학생 축구대회’에서 코로나19 확진자 8명이 발생해 대회가 전격 중단됐다. 전북도는 금석배 축구대회에 참석중인 경기도 중학생 2명과 지도자 2명, 숙소 주인 및 가족 4명 등 8명이 코로나19에 확진됐다고 28일 밝혔다. 경기도 원정팀은 지난 22일부터 해당 숙소에서 머물러 온 것으로 파악됐다. 올해 금석배 축구대회는 전국 156개 팀이 참가했고, 24일부터 13일간 개최될 예정이었다. 군산시는 “무관중 경기를 실시하고 선수단 도착 시 발열검사와 코로나19 검사 결과지 제출 후 숙소와 훈련장으로 이동하게 하는 등 방역에 최선을 다했다”면서 “안타깝게 확진자가 발생해 대회를 중단하게 됐다”고 설명했다. 전북도내에서는 27일과 28일 오후 2시까지 코로나19 확진자 40명이 추가로 발생했다. 전북지역 누적 확진자는 2716명이다. 전북도도 관계자는 “29일 0시를 기해 강화된 내용의 다중이용시설 방역관리자 지정·운영에 관한 행정명령을 내릴 방침”이라고 말했다.",https://www.khan.co.kr/national/national-general/article/202107281512001,사회,경향
 깜깜이 ‘쿠팡이츠 이벤트’에 뿔난 배달라이더···“주는대로 받기만 하란 거냐”,"쿠팡이츠 ‘파트너’인 배달기사 강모씨(36)는 요즘 점심·저녁 시간만 되면 낮아지는 배달 단가 때문에 스트레스를 받고 있다. 물리적(사회적) 거리 두기 단계 상향 등으로 배달 주문량이 늘어난 만큼 쿠팡이츠가 주요 시간대 배달 단가를 하한선인 2500원까지 떨어뜨리기 때문이다. 그러던 중 강씨는 쿠팡이츠 측이 파트너들에게 공지한 ‘피크타임 이벤트’에 귀가 솔깃했다. 점심·저녁 ‘피크타임’에 정해진 지역에서 배달 건수 목표를 달성하면 추가 수당을 주는 이벤트다. 강씨는 추가 수당을 받기 위해 ‘피크타임 이벤트’에 참여하고 바쁘게 배달을 다녔다. 그런데 주간 단위로 입금되는 금액은 강씨가 예상했던 금액보다 늘 몇 만원씩 모자랐다. 강씨는 “수기로 써 온 배달 기록과 비교해보면 실제로 벌었어야 하는 금액에 비해 50만원쯤 적게 들어온 것 같다”며 “분명 이벤트에 참여한 기록이 남아있을 테니 회사에 그걸 확인해달라고 했지만, 쿠팡이츠 측은 e메일로 정산 내역만 통보할 뿐 다른 내용은 알려줄 수 없다더라”고 말했다. 쿠팡이츠 파트너들 사이에선 ‘피크타임 이벤트’ 정산 과정이 불투명하다는 원성이 자자하다. 파트너 전용 애플리케이션(앱)에는 배달 건수 목표를 달성했는지, 아니면 실패했는지 곧바로 확인할 수 있는 별도의 시스템이 없다. 배달을 마쳤다는 증거를 남길 수 있는 휴대전화 화면 캡처는 ‘보안상의 이유’로 원천적으로 불가능하다. 파트너들은 매주 지급되는 수당을 보고 나서야 대강 어느날쯤 ‘이벤트에 성공했겠거니’ 짐작만 할 수 있을 뿐이다. 피크타임에는 전용 앱을 무조건 온라인 상태로 유지하고 있어야 한다는 까다로운 조건도 있다. 배달을 위해 엘리베이터나 지하주차장 등을 잠시 들렀다가 통신이 잠시 끊기는 바람에 배달을 완료하고도 이벤트 목표 달성에 실패하기도 한다. 이벤트 목표 달성 여부을 포함해 정산 관련 문의를 하고 싶어도 연락할 방법이 마땅치 않다. 서울 관악구 위주로 활동하는 파트너 임모씨(56)는 “고객센터에 전화를 하면 아르바이트생이 받아서 ‘e메일로 보내라’는 말만 되풀이한다”고 말했다. 실제로 ‘쿠팡이츠 라이더 대상 재택근무 상담원’을 모집한다는 한 아르바이트 구직 사이트의 게시물을 확인해보니 모집 주체는 쿠팡이츠가 아니라 한 대행업체였다. 경기 남부 지역에서 주로 일하는 박모씨(27)는 “4월에 정산내역서를 요청했었는데 이달에야 답이 올 정도로 응답이 늦다”고 말했다. 이에 대해 쿠팡이츠 측은 “(파트너들의) 예상 금액과 실제 정산 금액이 다를 경우엔 소명 과정을 거쳐서 차액을 정산하고 있다”고 밝혔다.",https://www.khan.co.kr/national/national-general/article/202107281457001,사회,경향
" 조직검사 중 동의 없이 폐 절제한 의사···대법 ""11억 배상"" 확정","조직검사 중 환자의 동의 없이 폐 일부를 잘라낸 의사가 거액의 손해배상금을 물게 됐다. 대법원 1부(주심 김선수 대법관)는 환자 A씨가 서울성모병원과 소속 의사 B씨를 상대로 낸 손해배상 소송 상고심에서 약 11억원을 배상하라며 원고 일부 승소 판결한 원심을 확정했다고 28일 밝혔다. A씨는 2016년 6월 서울성모병원에서 폐렴 관련 검사를 받던 중 조직검사에 동의하고 병원에 입원했다. B씨는 A씨를 전신마취한 뒤 조직검사용 검체를 채취하기 위해 쐐기 형태로 우측 폐 일부를 절제(쐐기절제술)했다. 판독 결과 이 검체에선 ‘악성 종양 세포가 없는 염증’이라는 소견이 나왔다. B씨는 쐐기절제술을 통한 조직검사로는 원인균을 확인하지 못할 가능성이 있고, 절제한 검체 부위에 염증이 있어 다시 봉합되지 않을 가능성도 우려된다는 이유로 폐 오른쪽 윗 부위(우상엽) 전체를 절제했다. A씨는 우상엽 전체를 절제하는 수술이었다면 동의하지 않았을 것이라며 약 20억원을 배상하라는 소송을 냈다. 조직검사를 의뢰한 목적은 폐렴의 원인균 파악이었고, 수술동의서를 작성할 무렵 쐐기절제술의 범위에 대해서도 민감한 반응을 보였다는 것이다. 1심은 A씨의 주장을 받아들였다. “반드시 우상엽 전체를 절제해야 하는 급박한 사정이 없었다”며 “B씨와 병원 의료진이 추가로 폐 절제술을 시행할 수 있다는 설명을 했거나 이에 A씨가 동의했음을 인정할 아무런 증거가 없어 A씨의 헌법상 신체를 훼손당하지 아니할 권리와 자기결정권이 침해되었다고 봄이 타당하다”고 했다. 그러면서 수술비와 간호비, 그리고 A씨의 월 소득에 따른 일실수입에 더해 3000만원의 위자료를 추가해 총 14억4000여만원을 배상하라고 판결했다. 일실수입은 월 3000만원을 버는 법무법인 파트너 변호사인 A씨가 ‘가동연한’(일할 수 있는 기간)인 만 70세가 되는 2040년 12월까지 얻을 수 있는 소득을 대입해 계산했다. 2심 재판부도 1심과 같은 판단을 유지했지만 월 소득을 일부 조정해 총 11억여원을 배상하라고 판결했다. A씨가 일하는 법무법인은 만 60세가 정년인데, 정년 이후부터 만 70세까지 현재와 같은 수준의 소득을 올릴 수 있다는 점이 증명되지 않았다고 했다. 재판부는 정년부터 만 70세까지는 (경력) 10년 이상 남자 변호사의 통계소득인 월 767만2000원을 기준으로 일실수입을 다시 계산했다. 대법원은 항소심 판단에 문제가 없다며 이를 확정했다.",https://www.khan.co.kr/national/national-general/article/202107281424001,사회,경향
 코로나19 장기화 속 돌봄서비스 늘리고 학생·1인가구 정서 안정 지원한다,"정부가 코로나19 상황에서 수요가 급증하는 아동돌봄 서비스를 늘리기 위해 학교 안팎의 시설을 활용한 돌봄서비스를 확대하는 방안을 추진한다. ‘코로나 블루’ 등 감염병 사태 장기화에 따른 학생들의 정서·심리 건강을 보호하는 프로그램이 가동되고, 1인 가구에 대해서도 청년·중년·노년 등 생애주기에 따라 필요한 사회관계망을 지원하는 프로그램을 마련해 고립을 막는다. 교육부는 정부세종청사에서 제13차 사회관계장관회의를 개최하고 이같은 내용을 담은 ‘사회분야 일상회복 지원방안’을 논의했다고 28일 밝혔다. 정부는 먼저 돌봄운영시간이나 인력운용, 행정업무 등 현장에서 개선 목소리가 높은 부분을 찾아, 8월까지 ‘초등돌봄교실 운영 개선방안’을 마련할 계획이다. 지역 내 가용공간이 있는 학교나 외부시설을 활용한 ‘거점형 돌봄’ 사업을 지원한다. 공간 확보에 어려움을 겪는 학교들의 경우 조립식 가설 건축물인 ‘모듈러 교실’을 지원하는 방안도 검토중이다. 감염병 상황 지속에 따른 학생·일반인의 심리·정서 지원 프로그램도 가동된다. 초·중·고등학교 각 1학년 전원을 대상으로 학생정서 및 행동특성검사를 실시, 정신건강 고위험군에게는 치료비와 정신질환 예방교육 등 전문적인 의료서비스를 제공한다. 1인 가구에 대해서는 성별·연령별 실태·욕구를 파악하고, 고독·고립 방지를 위한 생애주기별 사회적 관계망 지원 프로그램이 운영된다. 아동학대 등 가족관계 문제 예방과 회복을 위한 부모교육도 강화된다. 부모의 역할 등 생애주기별 특성에 부합하는 부모 교육과정 개발 하고 조손, 한부모, 다문화 가정 등 가족유형별 보호자의 역할과 교육·양육방법에 대한 콘텐츠 개발 지원도 강화키로 했다. 이날 회의에서는 보호 사각지대에 놓은 보호대상 아동·청소년의 지원과 관리를 강화하는 ‘보호대상 아동·청소년 지원방안’도 논의됐다. 현재 각 기관별로 분산 운영되고 있는 아동 관련 복지시스템은 ‘아동통합정보시스템’으로, 청소년 관련 복지시스템은 ‘위기청소년 통합지원시스템’으로 통합 운영된다. 임산부·만 2세 미만의 영아 가정을 방문·지원하는 ‘생애 초기 건강관리사업’을 2024년까지 전국 보건소로 확대하고, 내년부터 가족역량강화지원 사업 대상에 청소년 부모도 포함된다. 아울러 쉼터 입·퇴소 청소년도 보호종료아동과 마찬가지로 국가장학금 Ⅱ유형 대학 우선지원 권장대상 및 근로장학금 우선 선발 대상, 행복기숙사 입사우선 대상에 포함시키기로 했다.",https://www.khan.co.kr/national/education/article/202107281423001,사회,경향
 사상 최저 출생률에···‘M자형’ 여성 고용률 탈피 나선다,"‘취업-출산·육아 경력단절-비정규직 재취업’ 한국 여성의 고용률은 ‘M자형’ 곡선을 그린다. 20대에서 최고점을 찍은 뒤 30대에 급격히 떨어지고, 40대 들어 다시 높아졌다가 50대부터 하락세를 보인다. 사회초년생 땐 다양한 산업에 진출할지라도 재취업 시에는 서비스 분야로 몰린다. 2019년 한국 여성 고용률은 57.7%로 경제협력개발기구(OECD) 평균(61.3%)에도 못 미친다. 돌봄 서비스는 수요를 충족하지 못하고, 각종 제도는 다양해진 가족 형태를 따라가지 못한다. 이 같은 현실은 저출생 심화와 노동공급 감소로 이어지고 있다. 지난해 여성 1명이 평생 낳을 것으로 예상되는 합계출생률은 0.84명으로 사상 최저치를 기록했다. 이같은 상황 속에 여성의 경제활동을 지원하고 자녀 돌봄 부담을 덜어주기 위해 여성가족부가 28일 ‘여성고용 확대 및 모든 가족의 안정적 삶 지원방안’을 발표했다. 범부처 인구정책 태스크포스(TF)에서 11개 관계부처가 합동으로 마련했다. 우선 여성의 취업과 창업을 적극 지원한다. 여성새로일하기센터에서 진행하는 정보기술(IT), 디자인, 빅데이터 등 유망직종 직업교육훈련 지원 규모를 내년까지 175개, 2800명으로 늘린다. 학생부터 은퇴한 과학기술인에 이르기까지 여성과학인의 생애주기별로 멘토링·역량진단·컨설팅을 지원하는 온라인 플랫폼(W브릿지)를 운영한다. 더 많은 여성이 고용될 수 있도록 경력단절여성 고용 기업에게 지원하는 세액공제 요건을 ‘퇴직 후 3년 이상’에서 ‘2년 이상’으로 낮춘다. 그간 경력단절여성의 재취업 지원에 집중했다면, 앞으로는 일하는 여성들의 경력 유지에도 힘쓴다. 일하는 여성을 위한 상담·컨설팅·돌봄 관련 맞춤형 지원 모델을 개발하고 내년부터 시범사업을 벌일 계획이다. 아울러 평등한 노동환경 조성을 위한 제도를 내실화한다. 내년 5월부터 고용상 성차별 또는 직장 내 성희롱이 발생했을 때 사업주가 적절한 조치를 취하지 않으면 노동위원회가 시정명령 등을 통해 구제할 수 있다. 국가인권위법상 평등권을 침해하는 차별행위로 ‘중대한 사회적 물의’를 야기한 기업은 가족친화인증을 받지 못하도록 한다. 이 기준대로면 ‘성차별적 면접 질문’으로 논란을 빚은 기업은 심사에서 탈락하게 된다. 여가부는 오는 9월 ‘양성평등 임금의 날’ 첫 시행을 계기로 공공기관 뿐만 아니라 상장법인의 성별 임금격차도 발표할 예정이다. 자녀 돌봄 부담은 낮추고 다양한 가족을 존중하는 정책도 편다. 다함께돌봄센터 운영시간을 아침·저녁으로 연장하고, 내년부터는 집으로 찾아가는 ‘아이돌봄서비스’ 지원을 더 많이 받는 돌봄취약계층에 만 24세 이하 청소년 부모와 아동학대 우려 가정을 추가한다. 내년부터 주민등록상 재혼가정은 불필요하게 가족관계를 노출하지 않도록 ‘세대주와의 관계’ 표시 여부를 선택할 수 있게 한다. 본인이 원하면 ‘계부, 계모, 배우자의 자녀’ 표기를 ‘부, 모, 자녀’로 바꿀 수 있다.",https://www.khan.co.kr/national/health-welfare/article/202107281413001,사회,경향
 내년 상반기부터 주민증 없이 스마트폰만으로 신분 확인 가능해진다,"행정안전부는 내년 상반기부터 주민등록증을 가지고 있지 않아도 스마트폰을 통해 신분 확인을 할 수 있는 ‘주민등록증 모바일 확인 서비스’ 구축 사업을 추진한다고 28일 밝혔다. 주민등록증 모바일 확인 서비스는 스마트폰을 통해 이름, 주민등록번호, 주소, 발급기관 등 주민등록증에 수록된 사항을 보여주고 그 진위를 확인해 주는 기능을 제공해 주민등록증을 소지해야 하는 불편을 덜어주는 내용이다. 행안부는 이 서비스가 도입되면 주민등록증을 분실해 개인정보가 악용되거나 위·변조될 수 있는 위험이 줄어들고, 주민등록증을 상시 소지해야 하는  것에 따른 불편이 해소될 것으로 기대하고 있다. 행안부는 스마트폰에 주민등록증을 발급받아 개인정보를 저장하는 ‘모바일 신분증’과 달리 ‘주민등록증 모바일 확인서비스’는 별도의 발급 절차 없이 서비스 등록만으로 이용 가능하다고 설명했다. 주민등록증 수록사항을 스마트폰에 저장하지 않기 때문에 스마트폰을 분실하는 경우에도 개인정보가 유출될 염려가 없다. 이 서비스는 행정서비스 포털인 정부24(www.gov.kr)에서 본인확인 절차를 거친 뒤, 신분확인번호(QR코드)를 받아 주민등록증 수록사항을 화면에 표시하고 진위를 확인하는 방식이다. 주민등록시스템에서 주민등록증 수록사항이 실시간으로 암호화해 전송되며, 행안부는 위·변조방지 기술 등 다중 안전장치를 적용할 예정이다. 민원서류 접수, 자격인정 증서 발급, 편의점·식당 등에서 성년 여부 확인, 항공기·선박 탑승 시 신분 확인, 사인 간 계약·거래 시 본인 여부 확인 등에 주민등록증 모바일 확인 서비스를 이용할 수 있게 된다. 다만 법령에서 신분증 제시를 요구하는 경우에는 모바일 확인서비스가 아닌 실물 주민등록증으로 본인확인을 해야 한다. 행안부는 내년 상반기부터 주민등록증 모바일 확인 서비스를 시행할 수 있도록 시스템을 구축하고 법적 근거를 마련하기 위한 주민등록법 개정도 추진할 계획이다. 전해철 행안부 장관은 “주민등록증 모바일 확인서비스를 통해 국민들이 더 편리하게 신분 확인을 할 수 있게 될 것”이라며 “향후 모바일 기술의 보안성과 안전성이 검증되면 모바일 주민등록증으로 전환해 더 많은 행정영역에서 스마트폰을 통한 대국민 서비스를 제공할 것”이라고 말했다.",https://www.khan.co.kr/national/national-general/article/202107281402001,사회,경향
" 송영길, 정부가 못 밝힌 모더나 백신 물량 세부 공개…방역당국 “유감”","송영길 더불어민주당 대표가 라디오 방송을 통해 7월 연기된 모더나 백신의 세부 물량 등을 공개한 것과 관련해 방역당국이 유감을 표명했다. 모더나 백신 공급 지연 세부 물량 등은 제약사와의 비밀유지협약 대상으로, 방역당국은 이전에 공개하지 않았다. 송 대표는 28일 오전 KBS 라디오 <최경영의 최강시사>에 출연해 모더나 백신 공급 지연과 관련해 “모더나의 생산 과정에서 문제가 발생, 출하를 못하게 돼서 원래 한국이 25일 75만도스, 31일 121만도스 등 196만 도스를 받기로 한 게 연기가 됐다”며 “어제 권덕철 보건복지부 장관이 모더나의 존 로퍼 부회장과 생산 책임자와 긴급히 영상통화를 했고 일단 130만~140만회분 정도를 다음주에 제공받기로 이야기가 됐다. 8월 850만회분은 예정대로 들어온다고 한다”고 전했다. 손영래 중앙사고수습본부 사회전략반장은 이날 오전 정례브리핑에서 “모더나사와의 7월 공급 물량 연기 통보에 따라 어제 저녁 보건복지부 장관과 모더나 사의 생산 총괄 책임자, 부회장 등과 백신 공급과 관련된 협의를 했다”면서 “모더나사는 연기물량의 상당 부분을 다음 주에 우선 공급하고, 이후 8월 공급에 차질 없게 공급하겠다고 우리 정부와 협의했다”고 밝혔다. 이어 “세부적인 공급물량과 일정 등은 비밀유지협약의 대상 여부, 공급 일자 확정 등 후속 협의를 하는 중이기에 지금 공개하기는 어려우며, 이후 후속 협의 결과에 따라 공개 가능 범위만큼 다시 또 안내해드리도록 하겠다”고 했다. 송 대표가 라디오에서 7월 연기된 모더나 물량의 세부적인 물량을 공개한 것과 관련해 손 반장은 “정확하게 정해지지 않은 부분들이 현재 여러 과정에서 우선 다른 경로로 공개된 것에 대해서는 저희 중대본(중앙재난안전대책본부)로서도 다소 유감을 표하며 송구스럽게 생각한다”고 밝혔다. 다만 손 반장은 백신 공급 물량 등은 비밀유지협약 대상이지만 이번에 이례적으로 (모더나 측에서) 월 공급 물량을 맞추지 못한 상황에서, 공개된 일부 내용을 두고 비밀유지협약 위반 사항이라고 할 수 있는지 등도 검토가 필요한 부분이라고 설명했다.",https://www.khan.co.kr/national/health-welfare/article/202107281327001,사회,경향
" 코로나19 대유행에도 ‘매출 선방’ 지하철 역사 광고판, 왜?","지난 27일 서울 강남구 삼성역 안에 설치된 50개 광고판 중 빈 자리는 13개에 불과했다. 나머지 37개 광고판에는 게시물이 붙어 있었는데, 3분의 1은 연예인이나 유명인을 지지하는 팬들이 부착한 것이었다. 지하철 이용객들은 가던 길을 멈추고 아이돌의 생일이나 데뷔일 등을 기념하는 광고판을 구경하거나 사진을 찍기도 했다. 코로나19에 따른 경기 침체 국면에서 서울 지하철 역사 광고판은 ‘팬심’에 힘입어 매출 하락 폭이 적은 편이다. 28일 서울교통공사에 따르면 지하철 역사 광고 계약 건수는 2019년 1만468건에서 2020년 9947건으로 소폭 감소했다. 같은 기간 ‘연예인·유명인 광고’의 경우 되레 2166건에서 2300건으로 증가했다. 서울에서 가장 많은 승객이 타고 내리는 강남역과 과거 SM타운 코엑스 아티움이 자리했던 삼성역, 다수의 엔터테인먼트 회사가 밀집한 압구정역에서도 팬들이 연예인을 홍보하기 위해 제작한 광고를 쉽게 찾아볼 수 있었다. 압구정역에서 3년째 매점을 운영하는 정기안씨(62)는 “연예인 생일을 맞아 선물을 공유하는 팬들로 물품보관함이 꽉 찼던 적도 있다”고 말했다. 사회관계망서비스(SNS)에는 무더위에도 아랑곳 않고 직접 광고판을 찾아가 ‘인증샷’을 남기는 팬들의 게시물이 잇따르고 있다. 팬들은 SNS에 “지하철역 광고 투어를 했다”거나 “광고를 보려고 이 날씨에 삼성역까지 걸어가서 보고 왔다”는 글을 남겼다. 압구정역 인근에서 악세사리점을 운영 중인 고균재씨(33)는 “코로나19 발생 이후에도 사진을 찍고 가게에 들러 물건을 사는 분들이 있다”고 말했다. 연예인·유명인 광고는 2011년 지하철역에 처음 등장한 이후 해마다 늘고 있다. 서울교통공사 관계자는 28일 “코로나19로 인한 경기침체, 기존 전광판의 발광다이오드(LED) 교체 작업 등으로 전체적인 상업광고가 줄고 있지만 연예인 광고 건수는 꾸준히 증가하고 있다”고 말했다.",https://www.khan.co.kr/national/national-general/article/202107281120001,사회,경향
