headline,contents,url,category,name
"정부, 해상풍력발전 키운다…신재생에너지 공급 인증 가중치 상향","정부가 신재생에너지공급인증서(REC)의 해상풍력 에너지 가중치를 큰 폭으로 상향 조정했다. 산지 태양광은 가중치를 하향 조정하고, 석탄가스화 복합발전(IGCC)은 아예 가중치를 없앴다. REC는 신재생에너지 설비를 이용해 전기를 생산·공급했다는 인증서로, 가중치가 높아질수록 REC를 많이 얻을 수 있어 업체가 얻는 수익성도 높아진다. 산업통상자원부는 ‘신재생에너지 공급의무화제도 및 연료 혼합 의무화제도 관리·운영지침’을 일부 개정하고 28일부터 시행한다고 밝혔다. 개정안에는 에너지별 REC 기본 가중치 조정안이 담겼다. 이날 개정안에서 가중치가 가장 큰 폭으로 상향 조정된 것은 해상풍력 발전이다. 해상풍력의 가중치는 현행 2.0에서 2.5로 조정됐다. 여기에 수심은 5ｍ, 연계 거리는 5㎞ 증가할 때마다 0.4의 가중치를 추가 부여하기로 했다. 건축물 태양광은 시장 성숙에 따라 발전단가가 하락됐음에도 지붕·옥상 등의 효과적인 입지 활용을 위해 높은 가중치 수준을 유지하도록 했다. 반면 자연경관 훼손, 산지 안전성 논란이 제기된 산지 태양광은 신규 진입을 억제하기 위해 0.7에서 0.5로 하향 조정했다. 석탄 IGCC나 온배수열(수열)의 경우 화석연료 활용을 최소화하고자 기존 가중치를 모두 없앴다. 산업부는 REC 수급여건 개선을 통해 가격안정화와 신재생에너지 보급 확대를 적극 추진해나가겠다고 밝혔다. 먼저 개정 ‘신재생법’이 오는 10월21일부터 시행됨에 따라 연도별 신재생에너지 의무공급비율(RPS) 상향안을 마련해 내년 의무공급량부터 적용하기로 했다. RPS는 일정 규모 이상의 발전설비를 보유한 사업자에게 총발전량의 일정량 이상을 신재생에너지로 공급하도록 의무화한 것으로, RPS 상한은 10%에서 25%로 확대된다. 산업부는 또 신재생사업자의 가격안정성을 위해 변동성이 큰 현물시장의 비중을 점진적으로 축소하고, 장기고정계약 물량을 하반기에도 지속 확대해나가겠다고 밝혔다. 이 밖에도 커피찌꺼기, 버섯폐배지 등 유기성 폐자원의 에너지자원화를 위해 관계부처와 협력해 관련 규정을 정비하고 시범사업을 추진해 별도 가중치 신설도 검토할 방침이다. 산업부 관계자는 “현재 신재생사업을 진행 중인 사업자의 안정적 사업 추진을 위해 가중치가 하향되거나 제외되는 경우에는 종전 가중치를 받을 수 있도록 경과조치 규정을 설정했다”고 말했다.",http://biz.khan.co.kr/khan_art_view.html?artid=202107282029005&code=920501&med_id=khan,경제,경향
전자레인지·그릴·에어프라이어·토스터…한 대로 끝,"삼성전자가 4가지 가정간편식을 동시에 조리할 수 있는 신개념 조리기기 ‘비스포크 큐커(BESPOKE QOOKER)’를 28일 출시했다. 비스포크 큐커는 전자레인지·그릴·에어프라이어·토스터 기능을 모두 갖추고 있다. 기기 중앙의 전용 그릴 플레이트를 중심으로 위쪽 3개 구역, 아래쪽 1개 구역으로 총 4개의 요리 구역이 있어 한꺼번에 4가지 요리를 동시에 진행할 수 있다. 예컨대 상단의 3개 구역에 소고기 스테이크와 단단한 채소, 무른 채소를 각각 놓고 하단에 수프나 밥을 두면 4가지 음식으로 구성된 한 끼를 빠르게 조리할 수 있다. 구역별로 온도와 시간 등을 다르게 설정할 수 있다. 밀키트와 가정간편식 뒷면에 인쇄된 바코드를 휴대전화의 ‘스마트싱스 쿠킹’ 애플리케이션(앱)을 통해 스캔하면 최적의 조리값이 자동으로 설정된다. 이 기능을 쓰면 어떤 메뉴든 18분 이내에 조리가 끝난다. 삼성전자는 스캔쿡 기능을 구현하기 위해 프레시지, 마이셰프, 청정원, 풀무원, 오뚜기, 동원, hy(옛 한국야쿠르트), 앙트레 등 국내 대표 식품사 8곳과 전용 메뉴, 조리 알고리즘을 약 6개월간 공동 개발했다. 호텔신라를 비롯한 일부 회사는 큐커 전용 밀키트와 가정간편식 신제품도 출시할 예정이다. 제품 출고가는 59만원이며 글램 화이트, 글램 베이지, 글램 선옐로, 글램 핑크, 블랙 등 5가지 색상으로 출시된다. 삼성전자는 제품 출시를 기념해 2년간 매달 3만9000원 이상 식료품을 구매하는 경우 한시적으로 비스포크 큐커를 무료로 구매할 수 있는 혜택도 제공한다.",http://biz.khan.co.kr/khan_art_view.html?artid=202107282028045&code=930301&med_id=khan,경제,경향
전기차 배터리 교체 ‘전액 보상 특약’ 도입,"전기차 배터리 교체 비용을 전액 보상하는 특별약관(특약)이 오는 8월부터 모든 보험사에서 판매된다. 금융감독원은 28일 “일부 보험사만 전기차 배터리 교체 비용을 전액 보상하는 특약을 판매하고 있어 소비자의 선택권이 제한되는 문제점이 있었다”며 “전기차 배터리에 대한 보장을 강화해 소비자의 선택권을 확대하고 전기차 활성화를 촉진해 나가겠다”고 밝혔다. 우선 보장 사각지대를 해소하기 위해 소비자가 보험료를 부담하면 자기차량 사고 시 배터리 교체비용을 전액 보상하는 특약이 도입된다. 2015년 말 5712대였던 국내 전기차는 2020년 말 13만4962대로 늘어났다. 연평균 증가율이 453%에 이른다. 전기차는 일반 차량에 비해 평균 수리비와 부품비가 각각 31%, 52% 비싸다. 특히 고가 부품인 배터리는 부분 수리가 거의 불가능해 파손되면 아예 교체해야 하는 경우가 대부분이다. 이 때문에 소비자들은 보험료를 추가로 부담하고 배터리 교체 비용을 전액 보상받고 싶어하지만 일부 보험회사를 제외하고는 전액 보상 특약을 판매하지 않았다. 배터리 가액이 2000만원이고 내구연한이 15년인 전기차를 예로 들어보면, 차량 출고 후 2년이 지나 사고로 배터리가 파손돼 교체해야 할 경우 특약에 가입하지 않은 소비자는 배터리 가액의 15분의 2인 267만원을 부담해야 한다. 특약에 가입할 경우에는 소비자 부담 없이 보험사에서 2000만원을 모두 부담한다. 규정이 불분명해 분쟁 소지가 있었던 약관도 명확하게 보완된다. 금감원은 전기차 배터리의 경우에도 감가상각 해당 금액을 공제하고 보험금을 지급하는 중요한 부분품에 해당된다는 사실을 보험회사 개별 약관에 명시하도록 했다. 전기차 배터리 교체 비용 전액 보상 특약은 대부분 보험사가 8월 초부터 판매를 시작할 예정이다. 금감원 관계자는 “특약은 보험회사마다 가입 가능한 차량 연식 및 판매 시기가 다르고 차량 연식에 따른 보험료도 상이할 수 있다”면서 “특약 판매 시점 및 가입 가능 여부는 가입하려는 보험회사에 직접 확인해야 한다”고 말했다.",http://biz.khan.co.kr/khan_art_view.html?artid=202107282028035&code=920100&med_id=khan,경제,경향
애플·알파벳·MS 2분기 순익 65조,"“코로나19 전염병은 독특했지만, 그들(빅테크 기업)에게 완벽하고 긍정적인 폭풍우였다.” 토머스 필리폰 뉴욕대 금융학과 교수는 영국 일간 가디언에 이렇게 말했다. 27일(현지시간) 애플, 알파벳(구글의 지주회사), 마이크로소프트(MS) 등 미국 빅테크 기업들이 시장 예상치를 크게 웃도는 올 2분기 실적을 발표한 직후였다. 이들 3개 업체의 순이익을 합치면 567억3000만달러(65조5000억원)에 달했다. 애플은 이날 2분기(애플 자체 기준 3분기) 매출이 814억1000만달러(94조1262억원)를 기록하며 전년 동기 대비 36% 늘었다고 밝혔다. 이는 월가 예상치(733억달러)를 약 11% 웃도는 수준으로, 역대 2분기 실적 중 최고치다. 특히 아이폰 판매액은 395억7000만달러(5조6600억원)로, 전년 동기 대비 49.8% 증가했다. 서비스(33%)와 기타 제품(40%), 맥 컴퓨터(16%), 아이패드(12%) 매출도 일제히 늘었다. 중국(대만·홍콩 포함) 시장 매출이 58% 증가한 것으로 나타났다. 알파벳도 ‘어닝 서프라이즈’ 수준의 성적표를 내놓았다. 알파벳의 올 2분기 매출은 전년 동기 대비 61.6% 증가한 618억8000만달러(71조4400억원)를 기록했다. 월가 예상치 561억6000만달러를 크게 웃돌았다. 구글의 광고 매출은 504억4000만달러(58조2077억원)로, 코로나19 사태로 타격을 입은 전년 동기와 비교해 69% 늘었다. 유튜브 매출은 83% 증가한 70억달러(8조800억원)로 집계됐다. 이는 넷플릭스의 2분기 매출 73억4000만달러(8조4700억원)에 근접한 수치다. 세계 최대 소프트웨어 업체 MS도 2분기(MS 자체 기준 4분기) 매출이 461억5200만달러(53조3378억원)를 기록해 전년 동기 대비 21.3% 증가했다. 영업이익은 190억9500만달러(22조680억원)로 42% 급증했다. MS는 주당 순이익도 2.17달러로 시장 예상치(1.92달러)보다 높았다. 아마존과 경쟁을 벌이는 인텔리전트 클라우드 매출은 30%, 오피스 소프트웨어 판매액은 25% 증가했다. 다만 윈도와 게임, 검색 광고를 포함하는 퍼스널 컴퓨팅 매출은 9% 증가에 그쳤다.",http://biz.khan.co.kr/khan_art_view.html?artid=202107282028025&code=920100&med_id=khan,경제,경향
"이달 소비자심리지수, 올해 첫 하락","코로나19 4차 대유행에 따른 여파로 소비자 체감 경기가 올해 들어 처음 악화됐다. 한국은행이 28일 발표한 소비자동향조사 결과를 보면, 7월 소비자심리지수(CCSI)는 한 달 전보다 7.1포인트 하락한 103.2를 기록했다. CCSI는 지난해 코로나19 3차 대유행이 시작된 12월 91.2를 찍은 뒤 매달 조금씩 올라 지난 3월부터 100을 웃돌며 ‘낙관’으로 전환됐다. CCSI는 장기평균(2003∼2019년)과 비교해 100보다 높으면 소비심리가 낙관적이라는 의미로 해석된다. 한은 관계자는 “코로나19 백신 접종, 수출 호조 지속 등으로 상승하던 CCSI가 4차 대유행을 맞아 하락했다”고 밝혔다. CCSI의 6개 구성지수는 이달 들어 모두 하락했다. 현재생활형편(91), 가계수입전망(98)은 전월과 비교해 2포인트 내렸고, 생활형편전망(96)과 소비지출전망(108)도 각각 3포인트, 5포인트 하락했다. 현재경기판단(82)과 향후경기전망(92)은 각각 12포인트, 17포인트 급락했다. 취업기회전망(87)도 16포인트 내렸다. 가계의 저축 및 부채상황 인식을 보여주는 현재가계저축과 가계저축전망은 각각 1포인트 하락했고 현재가계부채도 1포인트 상승했다. 다만 하락 폭은 2∼3차 대유행 때보다는 작은 편이다. 소비자심리지수는 코로나19 확산 초기였던 지난해 1월 104.8에서 지난해 3월 73.3까지 급락했다. 한은 관계자는 “코로나19 확진자도 늘고 거리 두기 단계가 상향 조정됐으나 카페에 아예 앉을 수 없던 종전과는 달리 이번에는 완화한 면도 있다”며 “백신 접종률이 아주 높지는 않지만 30%를 넘었고, 7∼8월에도 (접종이) 진행될 것이기 때문에 불안심리가 덜한 것으로 보인다”고 말했다. 향후 1년의 소비자물가 상승률 전망 값에 해당하는 기대인플레이션율(2.3%)은 한 달 전과 같은 수준을 유지했고, 금리수준전망지수(126)는 연내 기준금리 인상 가능성 언급 등에 따라 2포인트 올랐다.",http://biz.khan.co.kr/khan_art_view.html?artid=202107282028015&code=920401&med_id=khan,경제,경향
“신중” 경고만 다섯번째…그래도 부동산 심리는 ‘거꾸로’,"정부의 ‘집값 고점’ 경고 수위가 갈수록 높아지고 있다. 최근 두 달 새 네 차례나 고점 경고에 나섰던 홍남기 부총리 겸 기획재정부 장관이 이번에는 “(집값이) 예상보다 크게 하락할 수 있다”고 말했다. 금융위원회는 “자산시장 과열”, 국토교통부는 “매년 신도시 1개 규모의 물량 공급” 등을 각각 언급하며 경고 대열에 동참했다. 그럼에도 전문가들은 연내 금리 인상 폭이 크지 않을 것이라는 이유 등을 들어 당장 집값이 꺾이긴 어렵다고 전망한다. 홍 부총리는 28일 부동산 시장 안정 관련 정부합동담화에서 “지금 아파트 실질가격, 주택구입 부담지수, 소득 대비 주택가격 비율 등 지표들이 최고 수준에 근접했거나 이미 넘어서고 있다”며 “불안감에 의한 추격매수보다 향후 시장 상황, 유동성 상황, 객관적 지표, 다수 전문가 의견 등에 귀 기울여달라”고 덧붙였다. 그는 ‘어느 정도 조정돼야 정상화로 볼 수 있느냐’는 질문에 “확정적으로 말씀드릴 수 있는 사안이 아니다”라면서도 “연내 금리 인상 가능성, 주택공급 물량 등을 고려할 때 가격 조정이 이루어진다면 시장의 예측보다는 좀 더 큰 폭으로 나타날 수도 있겠다는 예상을 하는 것”이라고 말했다. 홍 부총리가 집값 고점에 대한 우려나 경고성 발언을 한 것은 지난 5월24일 기재부 확대간부회의 이후 이번이 다섯번째다. 이날 경고 수위를 높인 것은 집값이 좀처럼 진정되지 않는 것에 대한 초조함의 방증으로 해석된다. 한국부동산원 자료를 보면 서울 아파트값은 올해 상반기에만 3.18% 오르며 지난해 연간 상승률(3.01%)을 이미 넘어섰다. 지난 19일 기준 주간아파트가격동향 집계에선 수도권 아파트값이 한 주간 0.36% 올라 집계가 시작된 2012년 5월 이래 최고 상승률을 기록했다. 금융위 “과열” 국토부 “물량 확대”전문가들은 “당장 아냐” 상승 판단 금융위와 국토부도 ‘지원사격’에 나섰다. 은성수 금융위원장은 “금융시장은 안정을 찾아가고 있지만 민간부채 급증, 일부 자산시장 과열 등 잠재적 리스크도 동시에 누적되고 있다”며 “글로벌 금리 상승 시 자산시장 가격조정이 맞물린다면 경제 전반에 부실이 확대될 수도 있다”고 밝혔다. 노형욱 국토부 장관은 “앞으로 10년 동안 전국 56만가구의 주택이 매년 공급된다”며 “특히 수도권의 경우 1기 신도시 물량(29만가구)이 해마다 공급되는 것”이라고 말했다. 노 장관은 “금리 인상, 가계대출 관리 상황에서 대규모 주택공급이 이뤄지면 주택시장 하향 안정세는 시장의 예측보다 클 것”이라고 덧붙였다. 정부는 이날 주택 조기공급을 늘리기 위해 사전청약을 확대하겠다고 밝혔다. 노 장관은 “사전청약을 통한 시장안정 효과를 극대화하기 위해 공공택지 민영주택, ‘3080(2·4대책)’ 도심공급물량에도 사전청약을 확대시행하는 방안을 적극 추진하겠다”고 밝혔다. 여당 내에서 시행 1년을 맞은 주택임대차보호법 개정 의견이 나오는 데 대해 홍 부총리는 “신규계약과 갱신계약 간 갭이 발생한다는 것을 잘 알고 있다”면서도 “당분간은 제도의 안착을 위해 주력하는 게 맞다”며 반대 의사를 나타냈다. 정부가 경고 수위를 높였지만 시장에선 집값이 상승세를 이어갈 것이라는 전망이 우세하다. 박원갑 KB국민은행 부동산수석전문위원은 “3기 신도시 사전청약 시작일을 맞아 전방위적인 메시지를 내놓은 것으로 보이지만 얼마나 효과가 있을지는 두고 봐야 한다”고 말했다. 함영진 직방 빅데이터랩장은 “연내 금리 인상이 이뤄져도 인상 폭이 크지 않을 것으로 보여 시장에 미치는 영향은 제한적일 것”이라며 “사전청약 확대의 경우 본청약까지 가격을 안정되게 유지하고, 수요가 높은 곳에 물량 공급이 가능할지가 관건”이라고 말했다.",http://biz.khan.co.kr/khan_art_view.html?artid=202107282028005&code=920202&med_id=khan,경제,경향
가상통화 거래소 집금계좌 94개 중 14개는 위장계좌,"가상통화 거래소 79곳이 사용 중인 입출금 계좌(집금계좌) 94개 가운데 14개가 위장계좌로 드러났다. 금융위원회는 위장계좌에 대해 거래 중단 조치를 취하기로 했다. 금융위는 입출금 계좌 발급이 가능한 3503개 금융회사와 함께 집금계좌 실태를 전수 조사한 결과 이같이 확인됐다고 28일 밝혔다. 가상통화 거래소 79곳 가운데 업비트, 빗썸, 코인원, 코빗 등 4대 주요 거래소만 실명확인 입출금계좌를 이용하고 있다. 나머지 75개 거래소는 실명확인이 되지 않는 집금계좌 90개를 이용하는 것으로 확인됐다. 2개 이상의 법인이 하나의 가상통화 거래소를 운영하는 경우도 있었다. 특히 가상통화 거래소 11곳은 타인 명의 위장계좌를 통해 입출금을 하고 있는 것으로 파악됐다. 확인된 위장계좌는 14개다. 가상통화 거래소들이 이용하는 집금계좌는 은행권 계좌가 59개로 가장 많았고, 이어 상호금융과 우체국이 각각 17개로 나타났다. 집금계좌 운영 실태를 보면, 사업계좌와 겸용으로 운영되는 곳이 많았고 집금·출금계좌를 은행을 달리해서 별도로 운영되는 곳도 있었다. 결제대행업체(PG)의 가상계좌 서비스나 펌뱅킹서비스를 이용하는 사례도 있었다. 금융위 관계자는 “PG사 가상계좌서비스는 이용자의 거래를 구별해서 관리가 어렵고, 펌뱅킹서비스는 개설은행과 제공은행이 인지하기 어려운 상황에서 집금·출금이 이뤄진다”고 말했다. 금융회사들이 집금계좌 개설과 모니터링을 강화하자 일부 가상통화 거래소는 별도 법인을 신설해 집금계좌를 개설하기도 했다. 규모가 작은 거래소는 상호금융사 및 중소규모 금융회사에 집금계좌를 개설하는 경우도 늘어나고 있는 것으로 파악됐다. 수도권 가상통화 거래소가 지방의 단위신협에서 집금계좌를 만든 사례도 있는 것으로 알려졌다. 일부 거래소는 위장계좌 거래중단 등 조치로 금융회사를 옮겨가며 위장계좌 개설과 폐쇄를 반복하고 있는 것으로 조사됐다. 금융위는 이번 조사를 통해 발견된 위장계좌에 대해 거래중단 조치를 취하고 관련 정보를 검·경에 제공할 에정이다. 금융위는 금융회사들이 발급한 집금계좌가 PG사의 가상계좌서비스, 펌뱅킹서비스와 연계되어 집금·출금에 사용되지 않도록 주의를 당부하고 PG사에도 가상계좌서비스, 펌뱅킹서비스 제공 시 반드시 위험평가를 진행하라고 요청했다. 금융위는 “일부 사업자가 특금법신고 기한 만료일인 9월24일까지 한시적으로 영업하면서 사업을 폐업할 위험이 있다”며 “거래소 이름과 집금계좌 명의가 다르면 위장계좌일 가능성이 크므로 주의해야 한다”고 밝혔다.",http://biz.khan.co.kr/khan_art_view.html?artid=202107281647001&code=920100&med_id=khan,경제,경향
"웃다가 지갑 여는 ‘라방’, 소비자 피해 책임은?","생활용품과 가전제품을 넘어 고가의 자동차와 오피스텔 분양권도 불티나게 팔린다. 시공간의 제약도 적다. 강원도 화천군은 지난 23일 흑토마토와 깜빠리 토마토 등을 2㎏들이 2400상자, 즉 4.8t이나 팔았다. 2㎏들이 1000상자(2t)를 준비했으나 예상 밖 호응으로 50분만에 두배 이상을 팔았다. 모두 ‘라방’(라이브 커머스 방송)에서 벌어진 일이다. 라방이 코로나19로 ‘뉴노멀’이 됐다. TV홈쇼핑과 유사한 라방은 모바일로 언택트(Untact) 형식을 취하지만 쌍방향 소통이 가능한 온택트(Ontact)를 지향한다. 형식과 내용에 제약이 없어 누구나 쇼호스트가 될 수 있다. 최근엔 라방을 ‘콘텐츠’로 보는 2030세대들이 늘면서 연예인이 진행하는 ‘예능형 라방’이 대세가 됐다. 28일 유통업계에 따르면 라방의 선두주자는 네이버다. 올해 2분기 네이버 라이브 커머스 매출은 전년 대비 17배 성장해 시장 점유율 50%를 넘어섰다. 라방에 참여한 판매자수는 620%, 월 거래액은 1300% 증가했다. 네이버는 라이브 커머스를 키우기 위해 전용 스튜디오를 열고, 중소상인들이 양질의 콘텐츠를 제공할 수 있게 돕는다. 판매자들에게도 라방은 다양한 판로를 확보할 수 있는 기회가 된다. 기존 유통업체에 비해 각종 수수료가 저렴해 경쟁력 있는 가격을 책정할 수 있고, 제품 홍보에도 도움이 된다. 소비자들은 실시간 소통으로 상품에 대한 정보를 입체적으로 얻어 구매로 이어가는 경우가 적지 않다. 이베스트투자증권에 따르면 전자상거래의 구매전환율(상품 노출 대비 판매량)은 0.3~1% 인데, 라이브 커머스는 5~8%에 달한다. 시장의 성장 가능성도 높다. 교보증권은 지난해 4000억원 수준이었던 국내 라이브 커머스 시장 규모가 2023년에는 10조원에 달할 것으로 전망했다. 빠르게 성장하는 만큼 ‘그늘’도 생겼다. 일부 라방에선 과장 광고가 성행해 ‘규제 사각지대’ 논란이 일고 있다. 실제로 온라인 플랫폼을 통해 연예인 등이 진행하는 라방에서 과채음료나 식품이 질병치료 등에 효과가 있는 것처럼 부당광고한 업체들이 최근 무더기로 적발됐다. 식품의약품안전처는 라이브커머스 플랫폼 업체 12곳을 집중 점검한 결과, 플랫폼 업체 6곳에서 부당광고 21건을 적발해 지난 22일 관계기관에 게시물 삭제와 행정처분 등을 요청했다. 단속 대상 플랫폼 업체에는 네이버쇼핑 라이브, 롯데백화점 100라이브, 티몬 티비온, 현대에이치몰 등이 포함됐다. 정부가 처음 라방 단속에 나서면서 소비자 보호를 위한 규제 논의도 본격화될 것으로 보인다. 방송에 제한이 없어 과장광고를 할 위험은 높은데 현행 법규로는 소비자 피해 발생 시 책임 소재가 명확하지 않다. 국회 과학기술정보방송통신위원회 소속 양정숙 의원(무소속)은 라이브 커머스 사업자가 방송을 녹화 등으로 보존하고, 소비자가 해당 영상을 열람·보존할 수 있게 하는 내용의 전자상거래법 개정안을 발의했다. 양 의원실 관계자는 “라방 속 허위·과장광고에 속아 제품구매 시 소비자가 이를 직접 증명하는 것이 어려운 만큼 소비자 보호를 위한 최소한의 장치를 마련하자는 취지”라고 말했다. 라방과 직결되지는 않지만 공정거래위원회가 준비하는 전자상거래법 전면 개정안이 통과되면 라방에 대한 관리 감독이 강화될 수도 있다. 공정위 관계자는 “(개정안으로) 플랫폼 사업자의 책임을 강화하면 라방 플랫폼 사업자들도 판매 등의 책임에서 자유롭지 못하게 될 것”이라고 말했다. 반면 업계는 새로운 시장인 만큼 분쟁조정기구 마련 등의 자구책으로 해결하겠다는 입장이다.",http://biz.khan.co.kr/khan_art_view.html?artid=202107281625001&code=920100&med_id=khan,경제,경향
