headline,contents,url,category,name
" ‘아랍의 봄’ 시작점 튀니지, 민주주의 흔들…대통령, 시위 격화에 총리 해임","북아프리카와 중동 지역을 휩쓴 반 독재정권 시위 ‘아랍의 봄’ 시작점인 튀니지의 민주주의가 흔들리고 있다. 카이스 사이에드 튀니지 대통령은 경제난과 코로나19 부실 대응 등으로 대규모 시위가 열린 직후 의회의 수반인 총리를 해임시켰다. 사이에드 대통령의 일방적 조치에 제1당이 반발하면서 튀니지 정계에서 분열과 혼란이 지속될 것이라는 전망이 나온다. 튀니지 언론 라프레세드튀니지는 25일(현지시간) 사이에드 대통령이 헌법 제80조에 명시된 대통령 권한을 발동해 제1당 엔나흐다 소속 히셈 메시시 총리를 해임시키고 의회의 기능을 30일 동안 정지시켰다고 보도했다. 의회 정지에 따라 국회의원들에 대한 면책 특권도 사라지게 된다. 사이에드 대통령은 이날 연설에서 자신이 임명하는 총리의 도움을 받아 행정부를 운영할 것이라며 “헌법은 의회 해산을 허용하지 않지만, 그 기능이 정지되도록 하는 것은 허용하고 있다”고 밝혔다. 사이에드 대통령은 구체적인 해임 이유에 대해서는 언급하지 않았다. 사이에드 대통령은 수도 튀니스 등 튀니지 곳곳에서 반정부 시위가 열린 이후 메시시 총리를 해임했다. 튀니지 시민 수천명은 지난 주말 동안 높은 실업률과 코로나19 대유행으로 인한 경제난, 정치인 부패 등에 대한 불만을 표출하기 위해 시위를 벌였다. 일부 시위대는 엔나흐다와 메시시 총리의 코로나19 방역 정책 실패를 비난하며 서부 토루즈 당사에 불을 질렀다. 사이에드 대통령은 25일 시위대를 향해 “폭력 시위를 지속하면 발포하겠다”고 경고했다. 튀니지 사회는 코로나19 확산과 시민들의 생활고가 이어지며 혼란을 겪고 있다. 이날 시위에 참가한 한 시민은 “우리의 인내심은 바닥이 났다. 정부는 전염병을 통제하지도, 백신을 제공하지도 못하고 있다”고 알자지라에 말했다. 튀니지는 아프리카 대륙 국가 중 남아프리카공화국에 이어 코로나19 확산이 심각한 나라로, 7월 들어 일일 확진자 수가 9000명대를 기록했다. 지금까지 1만8000명 이상이 코로나19로 사망하기도 했다. 튀니지 정부는 지난 1분기 실업률을 17.8%로 집계했다. 정계에서는 2019년 무소속 사이에드 대통령이 당선된 이후 행정부와 입법부 사이 권력 다툼이 이어지고 있다. 코로나19 확진자 수가 급증하자 메시시 총리는 지난 20일 파우지 메흐디 보건부 장관을 해임시켰다. 이에 사이에드 대통령은 다음날 행정부 소속인 군대가 코로나19 대응을 전적으로 맡겠다고 선언했다. 당시 알자지라는 전문가들을 인용해 “사이에드 대통령이 헌법에 명시된 대통령의 군사·외교 통솔권 이외에 다른 권한을 확장하려는 시도”라고 전했다. 대통령의 총리 해임 조치에 앞으로도 튀니지 정계의 분열은 더욱 심화될 것으로 보인다. 국회의장이자 엔나흐다 당대표인 라체드 가누치가 나흐다는 총리 해임에 대해 “헌법에 반하는 쿠데타”라며 반발했다. 튀니지 군대는 메시시 총리 해임 이후 의회 앞에 병력을 배치해 가누치 의장의 의회 출입을 막았다. 알자지라는 사이에드 대통령의 이번 조치가 민주화 이후 입법부, 행정부, 사법부 삼권 분립을 지키려는 튀니지 민주주의에 큰 어려움을 가져올 것이라고 평가했다. 튀니지는 2011년 북아프리카와 중동을 휩쓴 ‘아랍의 봄’의 발원지이자 아랍의 봄 운동이 일어난 지역 중 드물게 민주화에 성공한 국가로 꼽혀왔다. 튀니지의 한 20대 노점상이 막막한 생계를 호소하며 분신자살한 사건으로 시민들의 반정부 시위가 시작되며 23년간 독재 통치를 해온 지네 엘아비디네 벤 알리 튀니지 정권이 막을 내렸다. 아랍의 봄으로 알리 압둘라 살레 전 예멘 대통령과 무아마르 카다피 전 리비아 최고지도자 등 다른 나라의 독재 정권도 끝을 맺었다.",https://www.khan.co.kr/world/mideast-africa/article/202107261650001,국제,경향
" 영국도 '여군 성폭력' 심각…상급자는 민원은폐, 군법원은 솜방망이","여군 성추행 문제가 최근 국내에서 논란이 된 가운데, 영국에서도 비슷한 실태가 보고됐다. 영국 여군을 상대로 한 의회의 조사에서 응답자의 3분의 2가 따돌림과 괴롭힘, 차별 문제 등을 경험했다고 답한 것이다. 집단 강간 등 강력 범죄도 있었으나 군의 대응 시스템은 부실했던 것으로 전해졌다. 영국 의회 국방위 소위원회는 25일(현지시간) 4100명 이상의 여성 군인을 대상으로 군내 부조리 실태를 조사한 보고서를 공개했다. 이번 조사에서 여성 제대군인의 64%와 현역의 58%는 군대 내에서 집단 따돌림과 괴롭힘, 차별을 경험한 적이 있다고 응답했다. 집단 강간을 비롯해 약물 주입 후 성폭행, 미성년자 성착취 등의 강력 범죄가 있었다는 증언도 나왔다. 일부 여군은 성적인 접촉을 거부했다는 이유로 괴롭힘당했고, 동료들이 공격당하는 것을 목격하기도 했지만 두려워서 신고하지 못했다고 진술했다. 이같은 문제에도 군의 시스템은 허술했다. 대부분의 응답자들은 군이 문제를 해결하기 위한 충분한 노력을 기울이지 않고 있다고 답했다. 고위 장교들이 자신들의 입지를 보호하기 위해 민원을 은폐했다는 진술도 나왔다. 한국과 유사한 문제가 발견된 것이다. 사법체계의 문제도 있었다. 군 법원의 유죄 판결율이 민간 법원에 비해 4~6배 낮은 문제가 지적된 것이다. 이에 보고서는 군에서 발생한 강간과 성폭행 사건을 민간법원으로 넘길 것을 촉구하고, 지휘계통에서 분리돼 집단 따돌림과 괴롭힘, 차별 의혹을 조사하는 기구를 개설할 것을 강조했다. 새러 애서튼 소위원장은 이번 조사와 관련해 “최근 군대가 많이 발전했지만, 여전히 남자들의 세계인 것은 분명하다”며 “고충처리 시스템은 통탄할 지경으로 부족하고 대부분에게 무기력한 감정만을 남긴다”고 지적했다. 영국 국방부도 보고서 공개 직후 트위터를 통해 “군대 내 괴롭힘과 성추행은 결코 용납될 수 없고, 부적절한 행위를 근절하도록 노력하겠다”고 밝혔다.",https://www.khan.co.kr/world/world-general/article/202107261622001,국제,경향
 정치도 아빠 찬스···총선 앞둔 일본 ‘세습 정치’ 논란,"총선을 석달여 앞둔 일본 정치권에서 해묵은 ‘아빠 찬스’ 논란이 다시 불거지고 있다. 총선 불출마를 선언하고 지역구를 자식에게 물려주는 다선 의원들이 늘고 있기 때문이다. 지역구 세습을 제한해야 한다는 주장이 나왔지만, 여야 모두 공천 개혁에 소극적이다. 아사히신문은 26일자 사설에서 “각 정당은 정치 세습 금지를 검토하자”고 주장했다. 지난달 정기국회가 끝나자 자민당 중의원인 시오자키 야스히사(鹽崎恭久) 전 관방장관, 야마구치 다이메이(山口泰明) 선거대책위원장, 가와사키 지로(川崎二郞) 전 후생노동상이 정계 은퇴를 선언하고 장남이나 차남에게 지역구를 물려줬다. 시오자키, 가와사키 의원은 본인들도 각각 2대, 3대 세습 정치인이다. 제1야당인 입헌민주당에서는 아라이 사토시(荒井聰) 전 국가전략상이 장남에게 지역구를 물려줬다. 지역구 세습 제한은 일본의 묵은 정치개혁 이슈 중 하나다. 2017년 중의원 선거에서 자민당 당선자 중 지역구를 물려받은 이른바 ‘니세이(2세) 의원’은 83명으로 전체 의원의 29%에 달한다. 집권 자민당의 40%와 내각을 구성하는 각료의 절반가량이 세습의원이다. 일본 정치권에서는 부모에게 물려받는 지반(지역 기반), 간판(인지도), 가방(자금력) 등 이른바 ‘3반’(세 단어 모두 일본어로 ‘반’으로 끝남)이 당선 3요소라는 말이 있을 정도다. 하지만 ‘금수저 정치인’이 늘어날수록 정치가 일반 시민의 삶과는 동떨어질 가능성도 커진다. 아사히신문은 “정치 세습은 새로운 인재에 대한 문호를 좁히는 기득권 지키기로 이어질 수 있고, 사회 변화에 대응하는 정치의 힘을 약화시킨다”고 지적했다. 정치권 스스로 공천 개혁을 핵심 공약으로 내건 적이 있다. 민주당은 2009년 총선 당시 자당 소속 현직 국회의원의 지역구 세습을 막겠다고 약속했다. 자민당도 부랴부랴 세습 공천 제한을 뒤따라 공약했지만, 총선에서 패해 여당 자리를 내줬다. 당시 공약을 책임졌던 인물이 바로 스가 요시히데(菅義偉) 현 총리다. 스가 총리는 당시 “폭넓고 다양한 인재를 후보자로 등용해야 하지만, 특정인이나 특정 단체를 위한 정당이 되면서 국민 눈높이에서 어긋나기 시작했다”며 “당의 체질 개선책 중 하나가 세습 문제”라고 말했다. 고향 아키타(秋田)에서 멀리 떨어진 요코하마(橫濱)에 출마할 수밖에 없던 스가 총리는 세습 정치의 피해자이기도 하다. 그러나 2012년 자민당이 정권을 탈환하면서 정치 개혁은 없던 일이 됐다. 과거 세습 공천 제한을 공약했던 스가 총리도 지난해 취임 후 아소 다로(麻生太郞) 부총리 겸 재무상, 고노 다로(河野太郞) 행정개혁상, 고이즈미 신지로(小泉進次郞) 환경상 등 세습 정치인을 두루 기용했다는 지적을 받았다. 일본 정치권이 세습 공천을 포기할 수 없는 이유는 세습 정치인의 본선 경쟁력이 더 높다고 판단하기 때문이다. 인지도를 쉽게 높일 수 있는데다 정치자금도 상속받아 선거운동을 벌이기 쉽다. 게다가 일본은 대부분의 선거에서 투표용지에 직접 후보자의 이름을 써내는 ‘자필 기술식’ 투표 방식을 채택하고 있다. 유권자 입장에서는 익숙한 세습 후보 이름이 기억하기 쉽고 쓰기도 편하다. 산케이신문은 “코로나19 대응으로 스가 정권에 대한 비판이 커지는 만큼, 이번 중의원 선거에서 자민당의 고전이 예상된다”면서 “자민당에는 세습 정치의 조직력을 살린 선거전을 의석 확보로 연결하고 싶은 생각이 있을 것”이라고 짚었다. 여야도 세습 공천이 별문제 없다는 태도를 보였다. 니카이 도시히로(二階俊博) 자민당 간사장은 지난 20일 “인물이 좋은가로 최종 후보를 결정하고 있기에 세습이라서 좋을 것도 나쁠 것도 없다”고 말했다. 입헌민주당의 에다노 유키오(枝野幸男) 대표도 지난달 30일 “세습 정치인이라고 기계적으로 부정하는 것은 경직적”이라고 말했다. 그러나 세습 공천이 장기적으로는 정치권에 역풍을 초래할 수 있다는 지적도 나온다. 산케이신문은 이날 스가 총리의 과거 ‘세습 제한’ 공약을 언급하며 “선거에서 과거 행동과 일관성이 없는 것으로 보이면 신용이 떨어질 수 있다”고 전망했다.",https://www.khan.co.kr/world/japan/article/202107261534001,국제,경향
" 필립모리스, '말보로' 판매중단 선언… 연초담배, 역사 속으로?","유명 담배 제조사 필립모리스 인터네셔널(PMI)이 영국에서 ‘말보로’의 판매를 10년 내로 중단하겠다고 선언했다. 영국 정부의 연초형 담배 퇴출 기조에 맞춰 전자담배 등의 판매에 집중하겠다는 것이다. 2030년까지 ‘담배 없는 국가’가 되겠다는 영국의 시도가 다른 국가들로 확대될지 주목된다. 파이낸셜타임스(FT)와 텔레그래프 등 영국 현지매체들은 25일(현지시간) PMI가 영국 내 연초형 담배 흡연을 단계적으로 줄여나가기 위해 10년 내 말보로 등 기존 담배의 판매를 중단하고 대체재 판매에 집중할 것이라고 전했다. 야첵 올자크 PMI 최고경영자(CEO)는 언론 인터뷰에서 “담배는 2030년부터 판매가 금지되는 가솔린 자동차처럼 취급되어야 한다”며 “(10년 후에는) 담배 없는 세상을 볼 수 있을 것”이라고 말했다. PMI가 영국에서 벌어들이는 연수입은 약 8억파운드(약 1조2700억원)로 알려져 있다. PMI의 결정에는 영국 정부의 연초형 담배 퇴출 기조가 반영된 것으로 보인다. 앞서 영국은 2017년 ‘담배 없는 세대를 위한 담배규제 계획’을 발표하고 금연을 촉진하기 위해 전자담배 등 ‘대체제’를 활용토록 했다. 연초형 담배 사용자가 전자담배로 전환하면 흡연자가 아닌 것으로 분류된다. 이에 흡연율이 2012년 19.3%에서 2019년 13.9%로 떨어졌다. 2030년까지 흡연율이 5% 미만인 ‘담배연기 없는(smoke-free) 국가’가 되는 것이 영국 정부의 목표다. PMI도 향후 전자담배를 주력 산업으로 내세울 전망이다. PMI는 2017년 전자담배 ‘아이코스(IQOS)’를 출시한 뒤 공격적인 마케팅을 해왔다. 현재 매출의 약 4분의 1을 대체재에서 얻고 있으며, 이는 경쟁사들보다 높은 비율이다. 회사 측은 이달 초 천식치료제 등을 개발하는 영국 의약업체 ‘벡투라’를 인수하겠다는 방침도 내놨다. 이에 대해 올자크는 “헬스케어 및 웰빙 회사가 되려는 계획의 중요한 부분”이라고 소개했다. 이날 발표로 담배업계에선 연초형 담배 퇴출이 다른 국가들로 확대될지도 주목하고 있다. 다만 시장 내 주요 업체들이 연초형 담배 판매를 중단해도, 그 공백을 노리는 다른 업체가 등장할 수 있어 완전한 퇴출은 쉽지 않을 것이란 전망이 많다. 캐나다 최대 담배업체인 ‘임페리얼 토바코’의 스테판 봄하드 CEO는 지난 1월 “회사가 전자담배 등 대체재에 지나치게 초점을 맞추고 있다”며 전통적인 연초형 담배에 다시 초점을 맞추려는 움직임도 보였다. 일부 시민단체들은 PMI의 진정성에 의문도 제기했다. 수십년간 정·관계 로비 의혹 등으로 논란이 된 업체가 소비자의 건강을 생각한다고 하니 쉽사리 믿기 힘들다는 것이다. 미국 자선단체인 ‘담배없는 아이들을 위한 캠페인’(the Campaign for Tobacco-Free Kids) 측은 FT와의 인터뷰에서 “PMI는 지금도 전 세계 흡연자의 약 80%가 사는 중·저소득 국가들에서 (연초형) 담배를 집중적으로 마케팅하고 있다”며 “언행일치가 안되고 있는 것”이라고 지적했다.",https://www.khan.co.kr/world/world-general/article/202107261527011,국제,경향
" 미국, 개학철 다가오면서 제각각 학교 내 마스크 두고 긴장·갈등","마국 아칸소주 스프링데일에 사는 제니퍼 카터는 다음달 중순인 학교 개학일이 다가오면서 8살짜리 딸 루시를 새 학기에 학교 대면 수업에 참여시킬 것인가, 온라인 수업을 듣도록 할 것인가를 두고 심각한 고민에 빠져 있다. 미국에서는 12~17세 청소년은 화이자의 코로나19 백신을 맞을 수 있지만 12세 미만에게 접종이 허용된 백신은 없다. 코로나19 백신 접종률이 미국 평균에 비해 낮은 아칸소주 정부는 학교가 학생과 교직원에게 마스크 착용을 의무화하지 못하도록 했다. 마스크 착용 여부를 학생과 학부모 자율에 맡긴 것이다. 카터는 NBC방송과의 인터뷰에서 현재로선 딸 루시에게 마스크를 쓰고 학교에 가라고 할 생각이지만 교실에서 한두명만 마스크를 쓴다면 코로나19 방역에 무슨 도움이 되겠냐고 불평했다. 백신을 맞을 수 없는 아이들에게 마스크 착용 의무화를 금지시킨 것은 최후의 방역 수단을 빼앗은 것이라는 것이다. 8월부터 새학기가 시작되는 미국 전역에서 학교 내 마스크 착용 여부를 둘러싼 갈등과 긴장이 조성되고 있다. 논란은 유소년들의 코로나19에 대한 취약성, 그리고 마스크 착용 필요성에 대한 전문가들의 의견이 엇갈린다는 데에서 출발한다. 유소년들은 성인에 비해 코로나19 감염 위험이 낮고 감염되더라도 증상이 경미한 것으로 알려져 있다. 하지만 미국 질병통제예방센터(CDC)에 따르면 코로나19로 숨진 유소년은 약 500명에 달한다. 미국의 전체 코로나19 사망자 61만명 가운데 극히 적은 비율이긴 하지만 유소년이 코로나19 위험으로부터 완전히 자유로운 건 아니라는 뜻이다. CDC는 이달초 학교 마스크 착용과 관련해 백신 접종을 완료한 학생과 교직원은 실내외를 막론하고 마스크를 쓰지 않아도 되고, 백신을 맞지 않은 학생과 교직원은 실내에서만 마스크를 써도록 권고했다. 반면 미국소아과협회(AAP)는 최근 발표한 성명에서 대면수업의 이익이 코로나19 위험을 능가하기 때문에 대면수업을 지지한다면서 만 2세 이상은 누구나 학교에서 보편적으로 마스크를 써야 한다고 권고했다. 현실적으로 각 학교가 학생들의 백신 접종 여부를 일일이 가려내 마스크 착용 면제 또는 의무를 부과하기가 현실적으로 어려운데다 유소년에게 코로나19 위험이 전혀 없는 것도 아니라는 논리에서다. 지역별로도 제각각의 접근법이 나오고 있다. CNN방송은 아칸소를 비롯해 플로리다, 텍사스 등 최소 9개 주가 학교들이 마스크 착용을 의무화하는 것을 주 차원에서 금지시켰다고 보도했다. 반면 시카고와 보스턴, 수도 워싱턴 등 일부 대도시들은 다음달 개학 때 등교하는 모든 학생들에게 마스크 착용을 의무화하겠다고 밝혔다. 양쪽 모두 학부모들로부터 반발이 나오고 있다. 앞서 예로 든 카터의 경우처럼 주 정부가 학교 내 마스크 착용 의무화를 금지시킨 지역에선 백신을 맞고 싶어도 맞을 수 없는 12세 미만 학생들에겐 등교시 마스크 착용을 의무화해야 한다고 주장하고 있다. 반면 학교 내 마스크 착용 의무화 방침이 발표된 지역에서도 이에 반대하는 학부모들이 소송을 제기하는 등 반발하고 있다. 학교 내 마스크 착용 의무화에 반대하는 시민단체인 ‘미국 아이들에게 마스크 벗기기’ 회원인 로즈마리 웜리는 NBC방송에 백신이 널리 보급됐고 지역사회 감염도 낮아진 상황에서 코로나19 감염 위험이 상대적으로 적은 아이들에게 마스크 착용을 강제하는 것은 불공평한 부담을 지우는 것이라고 주장했다. 미국 전역에 지부를 두고 있는 이 단체는 획일적인 학교 내 마스크 착용 의무화보다는 각 지역의 코로나19 실상에 맞춰 탄력적으로 대응해야 한다고 주장하고 있다. 이에 대해 전문가들은 미국에서 코로나19 바이러스 우세종으로 자리잡은 델타 변이에 대한 유소년들의 취약성이 검증되지 않았고, 유소년들이 향후 등장할 수 있는 새로운 변이에도 상대적으로 덜 취약하리나는 보장이 없기 때문에 현재로선 마스크 착용이 최선의 방책이라고 반박한다. 정치전문매체 더힐은 미국이 지역별로 코로나19 감염률과 백신 접종률 등이 상이한 상황에서는 전국적으로 통일된 지침에 대한 합의를 기대하기가 현실적으로 어렵다면서 결국은 지역별 실정에 맞게 대처하는 수 밖에 없다는 전문가 의견을 소개했다. 감염 사례가 폭증하는 지역은 학교뿐 아니라 공공장소 마스크 착용을 강화하고 그렇지 않은 지역은 느슨하게 운영해야 한다는 것이다. 일례로 버지니아주는 모든 학생과 교직원이 실내에서 마스크를 쓰는 것이 좋다고 권고하면서도 각 교육청별로 지역 내 코로나19 상황과 전문가 조언을 감안해 각자 지침을 정할 수 있도록 했다.",https://www.khan.co.kr/world/america/article/202107261237001,국제,경향
 중국 “미국이 ‘가상의 적’ 만들어 자기 이익만 챙겨”…4개월만의 회담서 기선잡기,"셰펑(謝鋒) 중국 외교부 부부장이 26일 웬디 셔먼 미국 국무부 부장관과의 회담에서 미국이 중국을 ‘가상의 적’으로 만들어 국내적 불만을 돌리려 한다며 잘못된 정책을 바꾸라고 촉구했다. 셰펑 부부장은 이날 중국 톈진(天津)에서 열린 셔먼 부장관과의 회담에서 “현재 중·미 관계는 교착 상태에 빠지고 심각한 어려움에 직면했는데 이는 미국 일부 인사가 중국을 ‘가상의 적’으로 삼았기 때문”이라며 이같이 말했다. 지난 3월 미국 알래스카에서 열린 고위급 회담에서 양국이 강하게 충돌한 후 4개월여만에 이뤄진 고위 외교당국자간 만남에서 처음부터 양국 관계 악화의 책임을 미국에 돌리며 기선 잡기에 나선 것이다. 셰 부부장은 회담 초반 “미국은 중국을 악마화함으로써 정치, 경제, 사회 문제에 대한 국내 대중의 불만과 구조적 문제를 중국 탓으로 돌리려 한다”며 “중국을 무너뜨리기 위한 정부와 사회 전반의 캠페인이 벌어지고 있는 것으로 보인다”고 미국을 향해 강한 불만을 제기했다. 이어 “마치 중국의 발전이 억제되면 미국의 대내외적 도전이 모두 사라지고, 미국이 다시 위대해질 것으로 여기는 것 같다”면서 “우리는 미국이 이런 잘못된 사고방식과 위험한 정책을 바꿀 것을 촉구한다”고 말했다. 셰 부부장은 또 “미국은 경쟁·협력·적대적인 측면을 말하지만 중국 국민은 이를 중국을 억압하려는 얄팍한 시도로 보고 있다”면서 “미국은 적대적 측면에 중점을 두고 있으며, 협력과 경쟁은 편의와 수사적 함정에 불과하다”고 주장했다. 그러면서 “미국의 정책은 중국으로부터 무언가를 원할 때 협력을 요구하고, 중국이 유리하다고 판단될 때는 제재하면서 갈등과 대립에 의존한다”며 “자신이 원하는 결과를 얻고 자신의 이익을 증진시킬 생각만 하는데 세상에 이런 법이 어디 있느냐”고 불만을 토로했다. 다만 셰 부부장은 이 자리에서 미국과의 관계 개선 의지도 내비쳤다. 그는 “인류에게 가장 필요한 것은 연대와 협력이고, 중국인은 평화를 소중히 여긴다”며 “중국이 건설하고자 하는 것은 상호 존중과 공평, 정의, 상생협력을 특징으로 하는 새로운 형태의 국제관계와 인류 운명공동체”라고 강조했다. 이어 “중국은 미국과 다름을 인정하고 공통점을 찾길 원한다”며 “건강하고 안정적인 중·미 관계는 양쪽 모두의 이익에 부합할 뿐 아니라 국제사회가 모두 바라는 것”이라고 밝혔다.",https://www.khan.co.kr/world/america/article/202107261204001,국제,경향
